id	name	label	resource	description	synonyms	pmids	taxid	xrefs	raw_id
MONDO:0010917	chromosome 1q21.1 duplication syndrome	Disease	MONDO	Chromosome 1q21.1 duplication syndrome is a rare condition caused by the presence of an extra copy of a small piece of chromosome 1 in the cells of the body. Signs and symptoms can vary widely among affected individuals. Some individuals have no symptoms, while others may have features such as a large head size (macrocephaly); mild to moderate developmental delay and learning difficulties; autism or autistic-like behavior; heart problems; seizures; and/or and distinctive facial features. This condition can occur sporadically as a de novo mutation (by chance) or can be inherited in an autosomal dominant manner from a parent. Treatment depends on the signs and symptoms present in each individual. [https://rarediseases.info.nih.gov/diseases/10591/chromosome-1q211-duplication-syndrome]	trisomy 1q21.1|chromosome 1q21.1 duplication syndrome|chromosome 1q21.1 duplication syndrome, isolated cases|dup(1)(q21.1)|1q21.1 recurrent microduplication (possible susceptibility locus for neurodevelopmental disorders)|1q21.1 microduplication syndrome			OMIM:612475|MESH:C567290|DOID:0060435|ORDO:250994|MESH:C535938|UMLS:C2675891	MESH:C535938
MONDO:0007320	chromosome 20 trisomy	Disease	MONDO	Chromosome 20 trisomy, (also called trisomy 20) is a condition in which a fetus or individual has an extra full or partial copy of chromosome 20 in some or allof of his/her cells. An extra full copy of chromosome 20 in all of a person's cells is rare, and almost all fetuses with this do not survive past the first trimester ofpregnancy. The presence of an extra copyof only part of chromosome 20 is called partial trisomy 20; and an extra copy of chromosome 20 in only some of a person's cells is called mosaic trisomy 20. Mosaic trisomy 20 is the most common type of chromosome 20 trisomy and is one of the more common chromosomal abnormalities found during prenatal diagnostic testing. Studies have shown that the child is normal in the vast majority of prenatally diagnosed individuals. However, features that have been reported include spinal abnormalities (including spinal stenosis, vertebral fusion, and kyphosis), hypotonia (decreased muscle tone), life long constipation, sloped shoulders, and significant learning disabilities despite normal intelligence. Trisomy 20 usually results from an error that occurs when an egg or sperm cell develops (before fertilization); mosaic trisomy 20 usually results from errors in cell division soon after fertilization. [GARD:0005332]				MESH:C535939|MESH:C535372|UMLS:C0265479	MESH:C535939
MONDO:0008971	chromosome 2p16.1-p15 deletion syndrome	Disease	MONDO	2p15p16.1 microdeletion syndrome is a recently described syndrome characterized by developmental delay and facial dysmorphism. [Orphanet:261349]	chromosome 2p16.1-p15 deletion syndrome|Del(2)(p15p16.1)|2p15p16.1 microdeletion syndrome|2p15-p16.1 microdeletion syndrome|monosomy 2p15-p16.1|chromosome 2p16.1-p15 deletion syndrome, isolated cases|monosomy 2p15p16.1			ORDO:261349|OMIM:612513|UMLS:C4304538|DOID:0060415|UMLS:C2675875|MESH:C565855|MESH:C567289	MESH:C565855
MONDO:0007325	partial duplication of the long arm of chromosome 3	Disease	MONDO	Chromosome 3q duplication is a chromosome abnormality that occurs when there is an extra copy of genetic material on thelong arm (q) of chromosome 3. The severity of the condition and the signs and symptoms depend on the size and location of the duplication and which genes are involved. Features that often occur in people with chromosome 3q duplication include developmental delay, intellectual disability, behavioral problems and distinctive facial features. Chromosome 3q duplication can be de novo or inherited from a parent with a chromosomal rearrangement such as a balanced translocation. Treatment is based on the signs and symptoms present in each person. [GARD:0005345]	partial duplication of chromosome 3q|partial trisomy of chromosome 3q|partial duplication of the long arm of chromosome type 3			MESH:C536813|ORDO:262851|MESH:C566127|UMLS:C0795809	MESH:C566127
MONDO:0013151	Choroidal Dystrophy, Central Areolar 3	Disease	MONDO					MESH:C567729	MESH:C567729
MONDO:0004885	partial duplication of chromosome 8	Disease	MONDO		partial duplication of chromosome type 8|partial trisomy of chromosome 8			DOID:980|ORDO:262638|MESH:C537941|MESH:C535358	MESH:C535358
MONDO:0001898	chromosome 8q21.11 deletion syndrome	Disease	MONDO	8q21.11 microdeletion syndrome encompasses heterozygous overlapping microdeletions on chromosome 8q21.11 resulting in intellectual disability, facial dysmorphism comprising a round face, ptosis, short philtrum, Cupid's bow and prominent low-set ears, nasal speech and mild finger and toe anomalies. [Orphanet:284160]	chromosome 8q21.11 deletion syndrome, isolated cases|Del(8)(q21.11)|monosomy 8q21.11|8q21.11 microdeletion syndrome|deletion 8q21.11|chromosome 8q21.11 deletion syndrome			DOID:0060425|UMLS:C4305343|ORDO:284160|OMIM:614230|HP:0000610|DOID:1417|MESH:D015862|UMLS:C3280231	MESH:D015862
MONDO:0016910	chromosome 8, trisomy	Disease	MONDO	A chromosomal abnormality consisting of the presence of a third copy of chromosome 8 in somatic cells. [NCIT:C36396]				MESH:C537942|MESH:C538296	MESH:C538296
MONDO:0015434	chronic periodontitis	Disease	MONDO	A chronic inflammatory process that affects the tissues that surround and support the teeth. [NCIT:P378]	periodontitis, chronic			ICD-9:523.40|MESH:D055113|ICD-9:523.4|MESH:C538304|ICD10CM:K05.3	MESH:C538304
MONDO:0012915	intellectual disability-myopathy-short stature-endocrine defect syndrome	Disease	MONDO	Intellectual disability-myopathy-short stature-endocrine defect syndrome is a rare congenital myopathy syndrome characterized by nonprogressive myopathy (manifesting with mild facial and generalized weakness, bilateral ptosis, and severe lumbar lordosis), severe intellectual disability, short stature, and sexual infantilism (due to hypogonadotropic hypogonadism). The presence of a small pituitary fossa was also noted. There have been no further descriptions in the literature since 1985. [Orphanet:3068]	Chudley-Rozdilsky syndrome			OMIM:253320|UMLS:C1854663|MESH:C535458|MESH:C567290|ORDO:3068	MESH:C567290
MONDO:0022757	eosinophilic granulomatosis with polyangiitis	Disease	MONDO	Eosinophilic granulomatosis with polyangiitis (EGPA), previously known as Churg-Strauss syndrome, is a systemic vasculitis of small-to medium vessels, characterized by asthma, transient pulmonary infiltrates, and hypereosinophilia. [Orphanet:183]	granulomatous vasculitis, eosinophilic|granulomatous vasculitides, eosinophilic|vasculitis, Churg-Strauss|angiitis, allergic|allergic granulomatosis angiitis|granulomatous allergic Angiitides|vasculitis, eosinophilic granulomatous|angiitis, granulomatous allergic|angiitides, allergic granulomatous|allergic granulomatous and angiitis|syndrome, Churg-Strauss|allergic angiitis|eosinophilic granulomatous vasculitis|angiitis, allergic granulomatous|vasculitis, Churg Strauss|allergic granulomatous Angiitides|CSS|angiitides, granulomatous allergic|allergic angiitides, granulomatous|allergic granulomatoses|allergic granulomatous angiitis|granulomatoses, allergic|vasculitides, eosinophilic granulomatous|EGPA|granulomatous angiitides, allergic|granulomatosis, allergic|Churg-Strauss syndrome|allergic angiitis and granulomatosis|granulomatous allergic angiitis|Churg-Strauss vasculitis|eosinophilic granulomatous Vasculitides|allergic angiitides|granulomatous angiitis, allergic|angiitides, allergic|Churg Strauss syndrome|allergic granulomatosis|allergic angiitis, granulomatous			DOID:3049|ORDO:183|UMLS:C0008728|MESH:D015267|MESH:C535372	MESH:C535372
MONDO:0012916	primary ciliary dyskinesia 13	Disease	MONDO	Any primary ciliary dyskinesia in which the cause of the disease is a mutation in the DNAAF1 gene. [MONDO:patterns/disease_series_by_gene]	CILD13|ciliary dyskinesia, primary, type 13|DNAAF1 primary ciliary dyskinesia|primary ciliary dyskinesia 13|primary ciliary dyskinesia caused by mutation in DNAAF1|primary ciliary dyskinesia type 13|primary ciliary dyskinesia 13 with or without situs inversus			UMLS:C2750790|DOID:0110618|MESH:C567713|MESH:C567289|OMIM:613193	MESH:C567289
MONDO:0016954	primary ciliary dyskinesia 23	Disease	MONDO	Any primary ciliary dyskinesia in which the cause of the disease is a mutation in the ARMC4 gene. [MONDO:patterns/disease_series_by_gene]	primary ciliary dyskinesia caused by mutation in ARMC4|ciliary dyskinesia, primary, type 23|ARMC4 primary ciliary dyskinesia|primary ciliary dyskinesia 23 with or without situs inversus|CILD23|primary ciliary dyskinesia type 23			MESH:C536813|OMIM:615451|DOID:0110609|UMLS:C3809548	MESH:C536813
MONDO:0022794	Ciliophora infectious disease	Disease	MONDO	Infections with protozoa of the phylum ciliophora. [MESH:D016770]	Ciliophora caused disease or disorder|Ciliophora disease or disorder			UMLS:C0085308|MESH:D016770|MESH:C537823	MESH:C537823
MONDO:0016929	circumvallate placenta syndrome	Disease	MONDO		circumvallate placenta syndrome			UMLS:C1859089|MESH:C565847|MESH:C537941|OMIM:215550	MESH:C537941
MONDO:0013646	citrulline transport defect	Disease	MONDO		citrulline transport defect			OMIM:215720|DOID:0060425|UMLS:C1859084|OMIM:614230|MESH:C536207	OMIM:614230
MONDO:0043452	CK syndrome	Disease	MONDO		X-linked intellectual disability-microcephaly-cortical malformation-thin habitus syndrome|CK syndrome, X-linked recessive|CK syndrome			MESH:C537942|OMIM:300831|DOID:0111898|ORDO:251383|UMLS:C3151781	MESH:C537942
MONDO:0005593	CLAPO syndrome	Disease	MONDO	CLAPO syndrome is a newly described syndrome consisting of capillary malformation of the lower lip (C), lymphatic malformation of the face and neck (L), asymmetry of face and limbs (A) and partial or generalized overgrowth (O). [Orphanet:168984]	CLAPO syndrome, somatic			MESH:C567763|UMLS:C2751313|MESH:D055113|OMIM:613089|ORDO:168984	MESH:D055113
MONDO:0009671	Clark-Baraitser syndrome	Disease	MONDO		MRD49|Clark-Baraitser syndrome|intellectual disability, autosomal dominant 49			MESH:C536208|MESH:C535458|OMIM:617752|ORDO:600731|UMLS:CN593636|UMLS:C2931130|OMIM:300602|DOID:0080234	MESH:C535458
MONDO:0015943	cochleosaccular degeneration-cataract syndrome	Disease	MONDO	Cochleosaccular degeneration-cataract syndrome is characterised by progressive sensorineural hearing loss due to severe cochleosaccular degeneration and cataract. So far, it has been reported in two families. Transmission is autosomal dominant. [Orphanet:3233]				DOID:3049|MESH:C536432|UMLS:C1861512|ORDO:3233|OMIM:120040|MESH:D015267	MESH:D015267
MONDO:0013174	coenzyme Q10 deficiency, primary, 3	Disease	MONDO	Any coenzyme Q10 deficiency in which the cause of the disease is a mutation in the PDSS2 gene. [MONDO:patterns/disease_series_by_gene]	coenzyme Q10 deficiency, primary, 3|coenzyme Q10 deficiency caused by mutation in PDSS2|coenzyme Q10 deficiency, primary, type 3|PDSS2 coenzyme Q10 deficiency			DOID:0070240|OMIM:614652|MESH:C567713|UMLS:C3553358	MESH:C567713
MONDO:0014193	autosomal recessive ataxia due to ubiquinone deficiency	Disease	MONDO	This syndrome is characterised by childhood-onset progressive ataxia and cerebellar atrophy. [Orphanet:139485]	autosomal recessive spinocerebellar ataxia type 9|SCAR9|autosomal recessive ataxia due to coenzyme Q10 deficiency|coenzyme Q10 deficiency, primary, type 4|ARCA2|autosomal recessive cerebellar ataxia type 2			OMIM:612016|UMLS:C4511089|ORDO:139485|UMLS:C2677589|MESH:C567436|DOID:0070241|DOID:0110609|OMIM:615451	OMIM:615451
MONDO:0005704	Cole-Carpenter syndrome	Disease	MONDO	An extremely rare form of bone dysplasia characterized by the features of osteogenesis imperfecta such as bone fragility associated with multiple fractures, bone deformities (metaphyseal irregularities and bowing of the long bones) and blue sclera, in association with growth failure, craniosynostosis, hydrocephalus, ocular proptosis, and distinctive facial features (e.g. frontal bossing, midface hypoplasia, and micrognathia). [https://orcid.org/0000-0001-5208-3432, Orphanet:2050]	bone fragility-craniosynostosis-proptosis-hydrocephalus syndrome			MESH:D016770|MESH:C535963|DOID:0060438|ORDO:2050|UMLS:C1862178	MESH:D016770
MONDO:0008986	colorectal cancer, hereditary nonpolyposis, type 6	Disease	MONDO	Any hereditary nonpolyposis colon cancer in which the cause of the disease is a mutation in the TGFBR2 gene. [MONDO:patterns/disease_series_by_gene]	hereditary nonpolyposis colon cancer caused by mutation in TGFBR2|colorectal cancer, hereditary nonpolyposis, type 6|TGFBR2 hereditary nonpolyposis colon cancer			MESH:C565847|OMIM:614331|UMLS:C1860896|MESH:C566039|DOID:0070273	MESH:C565847
MONDO:0008989	combined immunodeficiency with skin granulomas	Disease	MONDO		CID due to RAG 1/2 deficiency|combined immunodeficiency due to RAG 1/2 deficiency			MESH:C567115|ORDO:157949|OMIM:233650|UMLS:C2673536|MESH:C536207|DOID:0112253	MESH:C536207
MONDO:0010441	leukoencephalopathy-thalamus and brainstem anomalies-high lactate syndrome	Disease	MONDO	Leukoencephalopathy-thalamus and brainstem anomalies-high lactate (LTBL) syndrome is a rare, genetic neurological disorder defined by early-onset of neurologic symptoms, biphasic clinical course, unique MRI features (incl. extensive, symmetrical, deep white matter abnormalities), and increased lactate in body fluids. The severe form is characterized by delayed psychomotor development, seizures, early-onset hypotonia, and persistently increased lactate levels. The mild form usually presents with irritability, psychomotor regression after six months of age, and temporary high lactate levels, with overall clinical improvement from the second year onward. [Orphanet:314051]	combined oxidative phosphorylation defect type 12|combined oxidative phosphorylation deficiency type 12|combined oxidative phosphorylation deficiency caused by mutation in EARS2|LTBL|COXPD12|EARS2 combined oxidative phosphorylation deficiency|leukoencephalopathy-thalamus and brainstem anomalies-high lactate syndrome			OMIM:300831|DOID:0111898|DOID:0111493|OMIM:614924|ORDO:314051|UMLS:C3554079	OMIM:300831
MONDO:0013125	combined oxidative phosphorylation deficiency 22	Disease	MONDO		combined oxidative phosphorylation deficiency 22			OMIM:616045|DOID:0111498|MESH:C567763	MESH:C567763
MONDO:0030914	complement component 3 deficiency	Disease	MONDO	A rare genetic disorder with an autosomal recessive pattern of inheritance. It is caused by the ineffective or decreased biosynthesis of the third complement component, C3. C3 deficiency may also be acquired acutely post-infection or chronically from co-morbid autoimmune disorders. If C3 is adequately synthesized, its rapid depletion may result in a functional deficiency. Clinical signs of the inherited deficiency present within the first decade of life and are consistent with the signs of recurrent systemic infection or immune complex disease. Deficiency of serum C3 and its major cleavage product, C3b, will decrease the effective humoral immune response to encapsulated bacteria. Deficiency of C3 also impairs clearance of circulating immune complexes and therefore predisposes to rheumatic and renal disease. [NCIT:P378]	C3 deficiency|classic complement early component deficiency caused by mutation in C3|C3 classic complement early component deficiency			MESH:C536208|DOID:8354|ORDO:280133|OMIM:613779|UMLS:C1332655|UMLS:C3151071|MESH:C565169	MESH:C536208
MONDO:0007346	complement component 7 deficiency	Disease	MONDO	Any classic complement early component deficiency in which the cause of the disease is a mutation in the C7 gene. [MONDO:patterns/disease_series_by_gene]	complement component 7 deficiency|C7 classic complement early component deficiency|classic complement early component deficiency caused by mutation in C7			MESH:C536432|UMLS:C1864694|OMIM:610102|DOID:0060300|MESH:C566443	MESH:C536432
MONDO:0013838	complement factor b deficiency	Disease	MONDO		complement factor b deficiency			DOID:0070240|UMLS:C3809950|OMIM:615561|OMIM:614652	OMIM:614652
MONDO:0012784	recurrent Neisseria infections due to factor D deficiency	Disease	MONDO		recurrent Neisseria infections due to factor D deficiency			OMIM:613912|ICD-9:279.8|UMLS:C0398764|MESH:C565027|DOID:0070241|ORDO:169467|OMIM:612016	OMIM:612016
MONDO:0016085	complement factor H deficiency	Disease	MONDO		complement factor H deficiency			OMIM:609814|ICD-9:279.8|MESH:C562875|ORDO:93571|MESH:C535963|DOID:0060438	MESH:C535963
MESH:D003095	Collagen Diseases	Disease	CTD	Historically, a heterogeneous group of acute and chronic diseases, including rheumatoid arthritis, systemic lupus erythematosus, progressive systemic sclerosis, dermatomyositis, etc. This classification was based on the notion that 'collagen' was equivalent to 'connective tissue', but with the present recognition of the different types of collagen and the aggregates derived from them as distinct entities, the term 'collagen diseases' now pertains exclusively to those inherited conditions in which the primary defect is at the gene level and affects collagen biosynthesis, post-translational modification, or extracellular processing directly. (From Cecil Textbook of Medicine, 19th ed, p1494)				MESH:D003095|DOID:854	
MONDO:0013695	Colorectal Cancer, Hereditary Nonpolyposis, Type 6	Disease	MONDO					MESH:C566039	MESH:C566039
MONDO:0009306	Combined Cellular And Humoral Immune Defects With Granulomas	Disease	MONDO					MESH:C567115	MESH:C567115
MONDO:0013971	COMBINED OXIDATIVE PHOSPHORYLATION DEFICIENCY 12	Disease	MONDO					OMIM:614924|DOID:0111493	OMIM:614924
MONDO:0020727	COMBINED OXIDATIVE PHOSPHORYLATION DEFICIENCY 22	Disease	MONDO					OMIM:616045|DOID:0111498	OMIM:616045
MONDO:0013417	Complement Component 3 Deficiency, Autosomal Recessive	Disease	MONDO					MESH:C565169	MESH:C565169
MONDO:0012412	Complement Component 7 Deficiency	Disease	MONDO					MESH:C566443	MESH:C566443
MONDO:0014255	COMPLEMENT FACTOR B DEFICIENCY	Disease	MONDO					OMIM:615561	OMIM:615561
MONDO:0013487	Complement Factor D Deficiency	Disease	MONDO					MESH:C565027	MESH:C565027
MONDO:0012350	Complement Factor H Deficiency	Disease	MONDO					MESH:C562875	MESH:C562875
MESH:C537806	18-Hydroxylase deficiency	Disease	MESH						
MESH:C536769	46, XY female	Disease	MESH						
MESH:D020222	Abducens Nerve Injury	Disease	MESH	Traumatic injury to the abducens, or sixth, cranial nerve. Injury to this nerve results in lateral rectus muscle weakness or paralysis. The nerve may be damaged by closed or penetrating CRANIOCEREBRAL TRAUMA or by facial trauma involving the orbit.					
MESH:C540309	Abetalipoproteinemia neuropathy	Disease	MESH						
MESH:D063485	Acanthocheilonemiasis	Disease	MESH	A tropical infectious disease found mainly in Africa that is caused by the filarial parasite ACANTHOCHEILONEMA. Symptoms include skin rashes, abdominal, chest, muscle, and joint pains, neurologic disorders, skin lumps, and elevated levels of white blood cells. The parasite is transmitted through the bite of small flies.					
MESH:C536016	Achondrogenesis type 1B	Disease	MESH						
MESH:C536019	Achondrogenesis, type 4	Disease	MESH						
MESH:C536020	Achondroplasia and Swiss type agammaglobulinemia	Disease	MESH						
MESH:C566780	Actinic Prurigo	Disease	MESH						
MESH:C531736	Acute malaria	Disease	MESH						
MESH:C538224	Adams Nance syndrome	Disease	MESH						
OMIM:606771	ADIPONECTIN, SERUM LEVEL OF, QUANTITATIVE TRAIT LOCUS 3	Disease	OMIM						
MESH:C579887	African Hemochromatosis	Disease	MESH						
MESH:D000435	Alcoholic Intoxication	Disease	MESH	An acute brain syndrome which results from the excessive ingestion of ETHANOL or ALCOHOLIC BEVERAGES.					
MESH:D059707	Aliivibrio Infections	Disease	MESH	Infections with bacteria of the genus ALIIVIBRIO.					
MESH:D016301	Alveolar Bone Loss	Disease	MESH	Resorption or wasting of the tooth-supporting bone (ALVEOLAR PROCESS) in the MAXILLA or MANDIBLE.					
MESH:C563799	Amish Infantile Epilepsy Syndrome	Disease	MESH						
MESH:C565965	AMR Syndrome	Disease	MESH						
MESH:D000086582	Anosmia	Disease	MESH	Complete or severe loss of the subjective sense of smell. Loss of smell may be caused by many factors such as a cold, allergy, OLFACTORY NERVE DISEASES, viral RESPIRATORY TRACT INFECTIONS (e.g., COVID-19), aging and various neurological disorders (e.g., ALZHEIMER DISEASE).					
MESH:C000718907	Ansa pancreatica	Disease	MESH						
MESH:D054882	Antley-Bixler Syndrome Phenotype	Disease	MESH	An inherited condition characterized by multiple malformations of CARTILAGE and bone including CRANIOSYNOSTOSIS; midface hypoplasia; radiohumeral SYNOSTOSIS; CHOANAL ATRESIA; femoral bowing; neonatal fractures; and multiple joint CONTRACTURES and, occasionally, urogenital, gastrointestinal or cardiac defects. In utero exposure to FLUCONAZOLE, as well as mutations in at least two separate genes are associated with this condition - POR (encoding P450 (cytochrome) oxidoreductase (NADPH-FERRIHEMOPROTEIN REDUCTASE)) and FGFR2 (encoding FIBROBLAST GROWTH FACTOR RECEPTOR 2).					
MESH:D000094666	Aortic Intramural Hematoma	Disease	MESH	An atypical form of AORTIC DISSECTION in which subintimal dissection of the aortic TUNICA MEDIA without initial laceration of the aortic TUNICA INTIMA. It may begin from a rupture of the VASA VASORUM feeding aortic media.					
MESH:D053714	Aspermia	Disease	MESH	A condition characterized by the complete absence of SEMEN. This disorder should be differentiated from AZOOSPERMIA, absence of sperm in the semen.					
MESH:C565935	Asthma, Nasal Polyps, And Aspirin Intolerance	Disease	MESH						
MESH:C566615	Autoimmune Lymphoproliferative Syndrome, Type I, Autosomal Recessive	Disease	MESH						
MESH:C566614	Autoimmune Lymphoproliferative Syndrome, Type IB	Disease	MESH						
MESH:C537789	Axenfeld-Rieger anomaly with cardiac defects and sensorineural hearing loss	Disease	MESH						
MESH:C000719194	Barophobia	Disease	MESH						
MESH:D001497	Battered Child Syndrome	Disease	MESH	A clinical condition resulting from repeated physical and psychological injuries inflicted on a child by the parents or caregivers.					
MESH:C000719195	Belonephobia	Disease	MESH						
MESH:C565549	Bernard-Soulier Syndrome, Type B	Disease	MESH						
MESH:D001630	Bezoars	Disease	MESH	Concretions of swallowed hair, fruit or vegetable fibers, or similar substances found in the alimentary canal.					
MESH:D059266	Bisphosphonate-Associated Osteonecrosis of the Jaw	Disease	MESH	Necrotic jaws or other maxillofacial skeleton necrosis associated with bisphosphonate use (see BISPHOSPHONATES). Injury, dental procedures, and trauma can trigger the necrotic process.					
MESH:D001734	Bites, Human	Disease	MESH	Bites inflicted by humans.					
MESH:C564009	Bladder Exstrophy and Epispadias Complex	Disease	MESH						
MESH:C536233	Blepharophimosis syndrome type 1	Disease	MESH						
OMIM:612362	BODY MASS INDEX QUANTITATIVE TRAIT LOCUS 12	Disease	OMIM						
MESH:C563218	Brachyolmia Type 2	Disease	MESH						
MESH:C537407	Bruck syndrome 2	Disease	MESH						
MESH:D002057	Burns, Chemical	Disease	MESH	Burns caused by contact with or exposure to CAUSTICS or strong ACIDS.					
MESH:C538511	Cancer of the oviduct	Disease	MESH						
MESH:C000726747	CANVAS syndrome	Disease	MESH						
MESH:D002249	Carbon Monoxide Poisoning	Disease	MESH	Toxic asphyxiation due to the displacement of oxygen from oxyhemoglobin by carbon monoxide.					
MESH:D002252	Carbon Tetrachloride Poisoning	Disease	MESH	Poisoning that results from ingestion, injection, inhalation, or skin absorption of CARBON TETRACHLORIDE.					
MESH:D016534	Cardiac Output, High	Disease	MESH	A state of elevated cardiac output due to conditions of either increased hemodynamic demand or reduced cardiac oxygen output. These conditions may include ANEMIA; ARTERIOVENOUS FISTULA; THYROTOXICOSIS; PREGNANCY; EXERCISE; FEVER; and HYPOXIA. In time, compensatory changes of the heart can lead to pathological form of high cardiac output and eventual HEART FAILURE.					
MESH:C566052	Cardiomyopathy, Dilated, 1t	Disease	MESH						
MESH:C563819	Cataract, Congenital, Cerulean Type, 3	Disease	MESH						
MESH:C564619	Cataract, Sutural, with Punctate and Cerulean Opacities	Disease	MESH						
MESH:D055499	Catheter-Related Infections	Disease	MESH	Infections resulting from the use of catheters. Proper aseptic technique, site of catheter placement, material composition, and virulence of the organism are all factors that can influence possible infection.					
MESH:D000071697	Cellulite	Disease	MESH	Skin lumpiness or skin surface dimpling often seen on the thighs, buttocks and abdomen. It is due to protrusion of SUBCUTANEOUS FAT into the DERMIS layer of skin.					
OMIM:602197	CEREBELLAR DEGENERATION-RELATED AUTOANTIGEN 3	Disease	OMIM						
MESH:C563564	Cerebelloparenchymal Disorder VI	Disease	MESH						
MESH:C562856	Cerebral Palsy, Ataxic, Autosomal Recessive	Disease	MESH						
MESH:C562434	Cerebrooculofacioskeletal Syndrome 1	Disease	MESH						
MESH:C564953	Ceroid Lipofuscinosis, Neuronal, 1	Disease	MESH						
MESH:C537948	Ceroid lipofuscinosis, neuronal 1, infantile	Disease	MESH						
MESH:C537956	Cervical hypertrichosis neuropathy	Disease	MESH						
MESH:C564179	Charcot-Marie-Tooth Disease, Foot Deformity of	Disease	MESH						
MESH:C539595	Charcot-Marie-Tooth disease, Type 4A, axonal form	Disease	MESH						
MESH:C565761	Charcot-Marie-Tooth Neuropathy, Type 4B2, with Early-Onset Glaucoma	Disease	MESH						
MESH:D000075562	Charles Bonnet Syndrome	Disease	MESH	Repetitive visual hallucinations experienced mostly by elderly with diminished visual acuity or visual field loss, with awareness of the fictional nature of their hallucinations. It is not associated with delusions and other sensory hallucinations.					
MESH:D023341	Chills	Disease	MESH	The sudden sensation of being cold. It may be accompanied by SHIVERING.					
