id	name	label	resource	description	synonyms	pmids	taxid	xrefs	raw_id
MONDO:0007656	pernicious anemia	Disease	MONDO	Megaloblastic anemia caused by vitamin B-12 deficiency due to impaired absorption. The impaired absorption of vitamin B-12 is secondary to atrophic gastritis and loss of gastric parietal cells. [NCIT:P378]	Biermer anemia|Addison's anaemia|anemia pernicious|Addison-Biermer anemia|Biermer disease|juvenile onset pernicious anemia|acquired pernicious anemia|intrinsic factor deficiency|Biermer's anemia|pernicious anemia|Addison anaemia			OMIM:170900|ORDO:120|MESH:D000752|ICD-9:281.0|MESH:C535800|DOID:13381|UMLS:C0002892	MESH:C535800
MONDO:0008781	sideroblastic anemia 2	Disease	MONDO					DOID:0060065|MESH:C567145|OMIM:205950|MESH:C565956	MESH:C565956
MONDO:0011433	aneurysm, intracranial berry, 4	Disease	MONDO		ANIB4			MESH:C565700|OMIM:610213|DOID:0080967|MESH:C565796|UMLS:C1857749	MESH:C565796
MONDO:0001713	interventricular septum aneurysm	Disease	MONDO	Interventricular septum aneurysm is a rare, non-syndromic, congenital heart malformation characterized by the presence of a congenital aneurysm of the membranous portion of the interventricular septum. Patients may be asymptomatic or may present with ventricular or supraventricular tachycardia, fatigue, exertional dyspnea, palpitations, and cardiac murmur. Ventricular septal defects and conduction defects, such as first-degree atrio-ventricular block or incomplete right bundle branch block, may also be also associated. [Orphanet:99092]				MESH:D029502|ORDO:99092|OMIM:105805|MESH:C563239|UMLS:C1387721|DOID:1342	MESH:D029502
MONDO:0008228	angiomatosis, diffuse Corticomeningeal, of Divry and van Bogaert	Disease	MONDO	A megaloblastic anemia occurring in children but more commonly in later life, characterized by histamine-fast achlorhydria, in which the laboratory and clinical manifestations are based on malabsorption of vitamin B 12 due to a failure of the gastric mucosa to secrete adequate and potent intrinsic factor. (Dorland, 27th ed)	angiomatosis, diffuse Corticomeningeal, of Divry and van Bogaert			MESH:C536367|MESH:D000752|DOID:13381|OMIM:206570|UMLS:C1859783	MESH:D000752
MONDO:0008785	breast angiosarcoma	Disease	MONDO	A malignant vascular neoplasm arising from the breast. [NCIT:C5184]	breast angiosarcoma (disease)|breast angiosarcoma|angiosarcoma of the breast|angiosarcoma of breast|hemangiosarcoma of breast|breast hemangiosarcoma|hemangiosarcoma of the breast|angiosarcoma (disease) of breast			UMLS:C1332614|MESH:C567145|MESH:C536368|DOID:4511	MESH:C567145
MONDO:0012443	angiostrongyliasis	Disease	MONDO	A foodborne zoonotic disease, endemic to Southeast Asia and the Pacific Islands, caused by the rat lungworm Angiostrongylus cantonensis and that is acquired by the ingestion of the infective larvae on vegetables or in raw or undercooked snails, slugs, land crabs, freshwater shrimps, frogs and lizards. The main feature is eosinophilic meningitis, with clinical manifestations including fever, headache, malaise, fatigue, vomiting, rhinorrhea, blurred vision, diplopia, cough, stiff neck, enteritis, constipation and paraesthesia due to the movement of the worms from the intestines to the lungs, central nervous system and eyes. In severe cases without treatment, coma and death can occur. [Orphanet:74]				MESH:C565700|ICD-9:128.8|MESH:C536369|ORDO:74|UMLS:C0392662|DOID:0050256	MESH:C565700
MONDO:0007112	isolated anhidrosis with normal sweat glands	Disease	MONDO	Any anhidrosis in which the cause of the disease is a mutation in the ITPR2 gene. [MONDO:patterns/disease_series_by_gene]	anhidrosis caused by mutation in ITPR2|ITPR2 anhidrosis|Dann-Epstein-Sohar syndrome			UMLS:C1862871|OMIM:106190|ORDO:468666|DOID:0060603|MESH:C563239	MESH:C563239
MESH:D000787	aniridia 2	Disease	CTD	The symptom of paroxysmal pain consequent to MYOCARDIAL ISCHEMIA usually of distinctive character, location and radiation. It is thought to be provoked by a transient stressful situation during which the oxygen requirements of the MYOCARDIUM exceed that supplied by the CORONARY CIRCULATION.	aniridia type 2|aniridia 2; AN2|AN2|aniridia 2			MESH:D000787|HP:0001681|MESH:C536372|OMIM:617141	
MESH:D018322	ankle injury	Disease	CTD	Harm or hurt to the ankle or ankle joint usually inflicted by an external source. [MESH:D016512]	ankle injury|tarsal region injury|injury of ankle|injury of tarsal region			MESH:D018322|HP:0010615|MESH:D016512	
MONDO:0008793	annular erythema	Disease	MONDO		annular erythema			UMLS:C0234906|MESH:C536367|OMIM:106500|MESH:C562461	MESH:C536367
MONDO:0003024	anonychia-onychodystrophy syndrome	Disease	MONDO					MESH:C536368|DOID:4511|ORDO:90390|MESH:C536378|UMLS:C1862840	MESH:C536368
MONDO:0019143	anophthalmia plus syndrome	Disease	MONDO	Anophthalmia plus syndrome is a very rare multiple congenital anomaly syndrome characterized by the presence of anophthalmia or severe microphthalmia, cleft lip/palate, facial cleft and sacral neural tube defects, along with various additional anomalies including congenital glaucoma, iris coloboma, primary hyperplastic vitreous, hypertelorism, low-set ears, clinodactyly, choanal atresia/stenosis, dysgenesis of sacrum, tethering of spinal cord, syringomyelia, hypoplasia of corpus callosum, cerebral ventriculomegaly and endocrine abnormalities. An autosomal recessive inheritance has been suggested. [Orphanet:1104]	microphthalmia with facial clefting|Fryns microphthalmia syndrome			ORDO:1104|UMLS:C1833339|MESH:C537767|MESH:C536369|OMIM:600776	MESH:C536369
MONDO:0007118	anorexia nervosa	Disease	MONDO	A disorder most often seen in adolescent females characterized by a refusal to maintain a minimally normal body weight, an intense fear of gaining weight, a disturbance in body image, and, in postmenarcheal females, the development of amenorrhea. [NCIT:P378]				ICD10CM:F50.0|OMIM:106190|DOID:8689|ICD-9:307.1|DOID:0060603|MESH:D000856|ORDO:36297	OMIM:106190
MONDO:0014937	anterior spinal artery stroke	Disease	MONDO					MESH:C536372|MESH:C537776|UMLS:C2931608	MESH:C536372
MONDO:0043895	anthracosilicosis	Disease	MONDO	Fibrosis of the lung parenchyma caused by inhalation of carbon and silica dust. It manifests as shortness of breath. [NCIT:P378]				MESH:D000874|UMLS:C0003164|DOID:10324|MESH:D016512	MESH:D016512
MONDO:0007128	Annular Erythema	Disease	MONDO					MESH:C562461	MESH:C562461
MONDO:0019577	aortic aneurysm, familial thoracic 11, susceptibility to	Disease	MONDO		aortic aneurysm, familial thoracic 11, susceptibility to			MESH:C536378|OMIM:617349	MESH:C536378
MONDO:0010930	Loeys-Dietz syndrome 2	Disease	MONDO	A rare autosomal dominant inherited disorder of connective tissue caused by mutations in either the TGFBR1 or TGFBR2 gene. Like Loeys-Dietz syndrome type I the disease is characterized by enlargement of the aorta and other arteries, and arterial tortuosity, but skeletal signs are typically less severe or absent in type 2. Skin abnormalities, such as velvety skin are often present in type 2. [NCIT:C114768]	Loeys-Dietz syndrome caused by mutation in TGFBR2|Loeys-Dietz syndrome type 2|Loeys-Dietz syndrome type II|Loeys-Dietz syndrome 2|TGFBR2 Loeys-Dietz syndrome			OMIM:610168|ORDO:91387|DOID:0070234|MESH:C537767|MESH:C537783|ORDO:558	MESH:C537767
MONDO:0005351	aortic valve disease 1	Disease	MONDO	Any aortic valve disease in which the cause of the disease is a mutation in the NOTCH1 gene. [MONDO:patterns/disease_series_by_gene]	aortic valve disease caused by mutation in Notch1|Notch1 aortic valve disease|aortic valve disease 1|AOVD1|NOTCH1 aortic valve disease|aortic valve disease caused by mutation in NOTCH1			UMLS:C3887892|DOID:8689|OMIM:109730|DOID:0080333|MESH:D000856	MESH:D000856
MONDO:0021896	aortitis	Disease	MONDO	Inflammation of the aorta. Causes include trauma, infectious disorders, and connective tissue disorders. [NCIT:P378]	inflammation of aorta|aorta inflammation			UMLS:C0003509|MESH:D001025|MESH:C537776|DOID:519	MESH:C537776
MONDO:0006653	recessive aplasia cutis congenita of limbs	Disease	MONDO	Recessive aplasia cutis congenita of limbs is an extremely rare variant of aplasia cutis congenita (ACC) characterized by the congenital absence of skin on the upper and/or lower limbs, with these lesions usually healing spontaneously resulting in a hypotrichotic scar. Recessive ACC of limbs may be associated with junctional epidermolysis bullosa. The inheritance was hypothesized to be autosomal recessive. There have been no further descriptions in the literature since 1980. [Orphanet:1115]				MESH:D000874|MESH:C536840|OMIM:600360|UMLS:C1838206|DOID:10324|ORDO:1115	MESH:D000874
MONDO:0020670	appendicitis	Disease	MONDO	Acute inflammation of the vermiform appendix. [NCIT:P378]	inflammation of vermiform appendix|vermiform appendix inflammation			ICD-9:541|MESH:C537779|DOID:8337|ICD-9:540-543.99|MESH:D001064|UMLS:C0003615	MESH:C537779
MONDO:0044301	aprosencephaly cerebellar dysgenesis	Disease	MONDO					OMIM:617349|ORDO:1126|UMLS:C1832412|MESH:C563331|OMIM:601374	OMIM:617349
MONDO:0012427	Joubert syndrome with oculorenal defect	Disease	MONDO	Joubert syndrome with oculorenal defect is a rare subtype of Joubert syndrome and related disorders (JSRD) characterized by the neurological features of JS associated with both renal and ocular disease. [Orphanet:2318]	Cerebellooculorenal syndrome|Dekaban-Arima syndrome|JS type B|CORS|Joubert syndrome with oculorenal defect|JS-OR|Joubert syndrome with Senior-Loken syndrome|Arima syndrome			ORDO:2318|UMLS:C1855675|MESH:C537783|OMIM:243910|MESH:C537430	MESH:C537783
MESH:D001019	arms, malformation of	Disease	CTD	The tearing or bursting of the wall along any portion of the AORTA, such as thoracic or abdominal. It may result from the rupture of an aneurysm or it may be due to TRAUMA.	arms, malformation of			DOID:3627|OMIM:107900|MESH:D001019|MESH:C566258	
MONDO:0024523	arteriolosclerosis	Disease	MONDO	The thickening of the wall of the small arteries and arterioles. It is caused by deposition of hyaline material in the wall or concentric smooth muscle wall hypertrophy. It results in lumen narrowing and tissue ischemia. [NCIT:P378]	arteriolosclerosis (morphologic abnormality)			OMIM:109730|DOID:5162|UMLS:C0878486|DOID:0080333|ICD10CM:I70|MESH:D050379	OMIM:109730
MESH:D001024	bacterial arthritis	Disease	CTD	The inflammation of one or more joints caused by a bacterial infection within the joint space. Symptoms include pain, stiffness, and decreased range of motion in the affected joint. [NCIT:C26699]	pyogenic arthritis|septic arthritis			ICD-9:711.94|ICD-9:711.91|ICD-9:711.97|ICD-9:711.0|DOID:1712|MESH:D001170|ICD-9:711.96|HP:0001650|ICD-9:711.40|ICD-9:711.92|DOID:813|ICD-9:711.95|MESH:D001024|ICD-9:711.9|ICD-9:711.93|ICD-9:711.90	
MONDO:0006656	arthrogryposis, congenital, lower limb, X-linked	Disease	MONDO	Inflammation of the wall of the AORTA.	ACLLX			UMLS:C1846273|DOID:519|MESH:C564574|MESH:D001025|OMIM:300158	MESH:D001025
MESH:D001044	arthrogryposis, distal, type 1B	Disease	CTD	Complete loss of phonation due to organic disease of the larynx or to nonorganic (i.e., psychogenic) causes.	arthrogryposis, distal, type 1B			DOID:0111598|MESH:D001044|UMLS:C3280526|OMIM:614335|HP:0001686	
MONDO:0010876	arthrogryposis-severe scoliosis syndrome	Disease	MONDO	Distal arthrogryposis type 4 is an inherited developmental defect syndrome characterized by multiple congenital contractures of limbs, without primary neurologic and/or muscle disease that affects limb function, and a mild to severe scoliosis. Intelligence is normal. [Orphanet:65720]	distal arthrogryposis type 4|distal arthrogryposis type IID			DOID:0111610|MESH:C536840|OMIM:609128|UMLS:C1836756|ORDO:65720|MESH:C563791	MESH:C536840
MONDO:0005649	arthrogryposis- oculomotor limitation-electroretinal anomalies syndrome	Disease	MONDO	Distal arthrogryposis type 5 is an inherited developmental defect syndrome characterized by multiple congenital contractures of limbs, without primary neurologic and/or muscle disease that affects limb function, and ocular anomalies (ptosis, external ophtalmoplegia and/or strabismus). Intelligence is normal. [Orphanet:1154]	distal arthrogryposis type 5|distal arthrogryposis type IIB|arthrogryposis- oculomotor limitation-electroretinal anomalies syndrome|oculomelic amyoplasia|distal arthrogryposis with ophthalmoplegia			DOID:0111608|DOID:8337|ORDO:1154|OMIM:108145|MESH:D001064|UMLS:C1862472	MESH:D001064
MONDO:0011062	autism spectrum disorder - epilepsy - arthrogryposis syndrome	Disease	MONDO	SLC35A3-CDG is a form of congenital disorders of N-linked glycosylation characterized by distal arthrogryposis (mild flexion contractures of the fingers, deviation of the distal phalanges, swan-neck deformity), retromicrognathia, general muscle hypotonia, delayed psychomotor development, autism spectrum disorder (speech delay, abnormal use of speech, difficulties in initiating, understanding and maintaining social interaction, limited non-verbal communication and repetitive behavior), seizures, microcephaly and mild to moderate intellectual disability that becomes apparent with age. The disease is caused by mutations in the gene SLC35A3 (1p21). [Orphanet:370943]	arthrogryposis, impaired intellectual development, and seizures|SLC35A3-CDG			ORDO:370943|UMLS:C3809910|OMIM:615553|MESH:C563331	MESH:C563331
MONDO:0009480	arthrogryposis multiplex congenita 1, neurogenic, with myelin defect	Disease	MONDO		arthrogryposis multiplex congenita, neurogenic, with myelin defect			OMIM:617468|DOID:0080978|MESH:C537430	MESH:C537430
MONDO:0007151	arthrogryposis multiplex congenita-whistling face syndrome	Disease	MONDO	Arthrogryposis multiplex congenita-whistling face syndrome is an extremely rare type of arthrogryposis multiplex congenita characterized by the combination of multiple joint contractures with movement limitation, microstomia with a whistling appearance of the mouth that may cause feeding, swallowing, and speech difficulties, a distinctive expressionless facies, severe developmental delay, central and autonomous nervous system dysfunction (excessive salivation, temperature instability, myoclonic epileptic fits, bradycardia), occasionally Pierre-Robin sequence, and lethality generally occurring during the first months of life. Arthrogryposis multiplex congenita-whistling face syndrome has been suggested to be a fetal akinesia deformation sequence. [Orphanet:1150]	Illum syndrome			OMIM:208155|MESH:C566258|MESH:C538401|ORDO:1150|UMLS:C1859711	MESH:C566258
MONDO:0006658	ascariasis	Disease	MONDO	An infection that is caused by the roundworm Ascaris lumbricoides, many cases of which remain asymptomatic. During the transient larval migratory phase, shortness of breath, fever, and eosinophilia can occur. Depending on the intestinal worm burden, a spectrum of gastrointestinal tract symptoms can occur. [NCIT:C128392]	Ascaris lumbricoides disease or disorder|Ascaris lumbricoides infectious disease|Ascaris lumbricoides caused disease or disorder|ascariasis - roundworm			UMLS:C0003950|MESH:D001196|DOID:5162|ICD-9:127.0|DOID:456|MESH:D050379|ICD10CM:B77	MESH:D050379
MONDO:0004471	Ascaridida infectious disease	Disease	MONDO	Infections with nematodes of the order ascaridida. [MESH:D017191]	Ascaridida disease or disorder|Ascaridida caused disease or disorder			MESH:D001170|HP:0003095|MESH:D017191|DOID:813	MESH:D001170
MONDO:0010260	aspartylglucosaminuria	Disease	MONDO	Aspartylglycosaminuria (AGU) is an autosomal recessive lysosomal storage disease belonging to the oligosaccharidosis group (also called glycoproteinosis). [Orphanet:93]	aspartylglucosaminidase deficiency|aspartylglycosaminuria|glycosylasparaginase deficiency|aspartylglucosaminuria			ORDO:93|MESH:D054880|UMLS:C0268225|DOID:0050461|OMIM:208400|OMIM:300158	OMIM:300158
MONDO:0013698	familial isolated congenital asplenia	Disease	MONDO	Familial isolated congenital asplenia is a rare, non-syndromic, potentially life-threatening visceral malformation characterized by the absence of normal spleen function, resulting in a primary immunodeficiency. Typically, the condition manifests with severe, recurrent, overwhelming infections (especially pneumococcal sepsis) in otherwise apparently healthy infants. In adults with no history of severe sepsis in infancy, thrombocytosis may be the presenting sign. Howell-Jolly bodies on blood smears and an absent spleen on abdominal ultrasound examination are highly suggestive associated findings. [Orphanet:101351]				MESH:C563028|OMIM:271400|DOID:0111598|ORDO:101351|OMIM:614335	OMIM:614335
MONDO:0012195	asthma-related traits, susceptibility to, 5	Disease	MONDO	Any inherited susceptibility to asthma in which the cause of the disease is a mutation in the IRAK3 gene. [MONDO:patterns/disease_series_by_gene]	asthma-related traits, susceptibility to, type 5|inherited susceptibility to asthma caused by mutation in IRAK3|asthma-related traits, susceptibility to, 5|asthma susceptibility 5|IRAK3 inherited susceptibility to asthma			OMIM:611064|DOID:0111610|MESH:C563791	MESH:C563791
MONDO:0007158	asthma-related traits, susceptibility to, 6	Disease	MONDO		asthma-related traits, susceptibility to, 6|asthma-related traits, susceptibility to, type 6			DOID:0111608|OMIM:611403|OMIM:108145	OMIM:108145
MONDO:0014248	asthma, short stature, and elevated IgA	Disease	MONDO		asthma, short stature, and elevated IgA			OMIM:208600|OMIM:615553|UMLS:C1859647|MESH:C565934	OMIM:615553
MONDO:0060486	ataxia-microcephaly-cataract syndrome	Disease	MONDO		ataxia-microcephaly-cataract syndrome			DOID:0080978|OMIM:208870|MESH:C563086|OMIM:617468|UMLS:C0796056	OMIM:617468
MONDO:0008825	autosomal dominant sensory ataxia 1	Disease	MONDO	Any hereditary ataxia in which the cause of the disease is a mutation in the RNF170 gene. [MONDO:patterns/disease_series_by_gene]	ADSA|RNF170 hereditary ataxia|hereditary ataxia caused by mutation in RNF170|SNAX1			DOID:0111170|UMLS:C1837015|OMIM:608984|MESH:C538401	MESH:C538401
MONDO:0005654	atrial fibrillation, familial, 1	Disease	MONDO	Infection by nematodes of the genus ASCARIS. Ingestion of infective eggs causes diarrhea and pneumonitis. Its distribution is more prevalent in areas of poor sanitation and where human feces are used for fertilizer.	atrial fibrillation, familial, 1|ATFB1			MESH:D001196|OMIM:608583|UMLS:C1843687|DOID:456|MESH:C538261	MESH:D001196
MONDO:0005656	atrial fibrillation, familial, 13	Disease	MONDO	Any familial atrial fibrillation in which the cause of the disease is a mutation in the SCN1B gene. [MONDO:patterns/disease_series_by_gene]	atrial fibrillation, familial, type 13|familial atrial fibrillation caused by mutation in SCN1B|atrial fibrillation, familial, 13|SCN1B familial atrial fibrillation			OMIM:615377|UMLS:C3809311|MESH:D017191	MESH:D017191
MONDO:0008830	atrial fibrillation, familial, 18	Disease	MONDO	Any familial atrial fibrillation in which the cause of the disease is a mutation in the MYL4 gene. [MONDO:patterns/disease_series_by_gene]	atrial fibrillation, familial, 18|atrial fibrillation, familial, 18; ATFB18|atrial fibrillation, familial, type 18|familial atrial fibrillation caused by mutation in MYL4|MYL4 familial atrial fibrillation|ATFB18			UMLS:C4310636|MESH:D054880|DOID:0050461|OMIM:617280|HP:0012068	MESH:D054880
MONDO:0010066	atrial fibrillation, familial, 7	Disease	MONDO	Any familial atrial fibrillation in which the cause of the disease is a mutation in the KCNA5 gene. [MONDO:patterns/disease_series_by_gene]	atrial fibrillation, familial, type 7|familial atrial fibrillation caused by mutation in KCNA5|KCNA5 familial atrial fibrillation|atrial fibrillation, familial, 7			OMIM:271400|MESH:C567389|OMIM:612240|UMLS:C2677106	OMIM:271400
MONDO:0012607	atrial fibrillation, familial, 8	Disease	MONDO		ATFB8|atrial fibrillation, familial, 8			OMIM:611064|OMIM:613055|UMLS:C2751607|MESH:C567802	OMIM:611064
MONDO:0012666	atrial septal defect 5	Disease	MONDO	Any atrial heart septal defect in which the cause of the disease is a mutation in the ACTC1 gene. [MONDO:patterns/disease_series_by_gene]	atrial heart septal defect caused by mutation in ACTC1|ASD5|ACTC1 atrial heart septal defect|atrial heart septal defect type 5|atrial septal defect type 5|atrial septal defect 5			MESH:C567561|OMIM:611403|OMIM:612794|DOID:0110110|UMLS:C2748552	OMIM:611403
MONDO:0008835	atrial septal defect, sinus venosus type	Disease	MONDO		ASD, sinus venosus type			ORDO:99105|MESH:C565934|MESH:C548009	MESH:C565934
MONDO:0008839	autosomal dominant auditory neuropathy 1	Disease	MONDO	Any auditory neuropathy in which the cause of the disease is a mutation in the DIAPH3 gene. [MONDO:patterns/disease_series_by_gene]	auditory neuropathy, autosomal dominant, type 1|AUNA1|auditory neuropathy caused by mutation in DIAPH3|nonsyndromic dominant auditory neuropathy|autosomal dominant auditory neuropathy type 1|NSDAN|DIAPH3 auditory neuropathy			MESH:C563790|MESH:C563086|OMIM:609129|UMLS:C1836743|DOID:0060690	MESH:C563086
MONDO:0012166	neurodevelopmental disorder-craniofacial dysmorphism-cardiac defect-hip dysplasia syndrome due to a point mutation	Disease	MONDO		Au-Kline syndrome|neurodevelopmental disorder-craniofacial dysmorphism-cardiac defect-hip dysplasia syndrome due to a point mutation			UMLS:C4225274|DOID:0111170|OMIM:616580|ORDO:453504|UMLS:CN237748|OMIM:608984	OMIM:608984
MONDO:0012066	autoimmune lymphoproliferative syndrome type 2A	Disease	MONDO	A rare, primary immunodeficiency with an autosomal dominant pattern of inheritance but incomplete penetrance. It is caused by a mutation in the CASP10 (caspase-10) gene that leads to defective Fas-induced apoptosis. Disruption of Fas-induced apoptosis impairs lymphocyte homeostasis and immune tolerance. Characteristic laboratory findings include an increase in circulating, double-negative (CD4-/CD8-) T cells in the setting of immune-mediated anemia, thrombocytopenia and neutropenia. Clinical signs present in childhood include fatigue, pallor, bruising, hepatosplenomegaly and chronic, non-malignant, non-infectious lymphadenopathy. The clinical course is influenced by a strong association with other autoimmune disorders and an increased risk for developing Hodgkin and non-Hodgkin lymphoma. [NCIT:C39576]	type 2 autoimmune lymphoproliferative syndrome|autoimmune lymphoproliferative syndrome type IIA|ALPS2A|CASP10 autoimmune lymphoproliferative syndrome|autoimmune lymphoproliferative syndrome caused by mutation in CASP10|autoimmune lymphoproliferative syndrome-CASP10 variant|autoimmune lymphoproliferative syndrome, type II|type 2 ALPS|ALPS-CASP10			OMIM:603909|UMLS:C1858968|UMLS:C1519709|DOID:0110115|MESH:C565833|MESH:C538261	MESH:C538261
MONDO:0014155	autoinflammation-PLCG2-associated antibody deficiency-immune dysregulation	Disease	MONDO		autoinflammation, antibody deficiency, and immune dysregulation syndrome|APLAID			OMIM:615377|UMLS:C3553961|OMIM:614878|DOID:0050650|ORDO:324530	OMIM:615377
MONDO:0015001	Axenfeld-Rieger syndrome type 3	Disease	MONDO	Any Axenfeld-Rieger syndrome in which the cause of the disease is a mutation in the FOXC1 gene. [MONDO:patterns/disease_series_by_gene]	Axenfeld-Rieger syndrome caused by mutation in FOXC1|FOXC1 Axenfeld-Rieger syndrome|anterior chamber cleavage syndrome|Rieger syndrome type 3|Axenfeld-Rieger anomaly with or without cardiac defects and/or sensorineural hearing loss|RIEG3|Axenfeld-Rieger syndrome type 3			OMIM:602482|ORDO:98978|ICD-9:743.44|ORDO:91483|OMIM:617280|DOID:0110122	OMIM:617280
MONDO:0012828	axial mesodermal dysplasia spectrum	Disease	MONDO	Axial mesodermal dysplasia spectrum is a rare developmental defect during embryogenesis syndrome characterized by congenital manifestations of both oculo-auriculo-vertebral spectrum and caudal regression sequence. Phenotype is highly variable but patients typically present facial dysmorphism (incl. asymmetry, hypertelorism), auricular abnormalities (e.g. preauricular tags, microtia, absence of middle ear ossicles), skeletal malformations (hemivertebrae, hip dislocation, sacral agenesis/dysplasia, talipes equinovarus, flexion deformity of lower limbs), cardiac defects (dextrocardia, septal defects), renal and genitourinary anomalies (such as renal agensis/dysplasia, abnormal external genitalia, cryptorchidia), as well as anal anomalies such as anal atresia and rectovesical fistula. [Orphanet:1834]	Russell-Weaver-Bull syndrome|blastogenesis defect			UMLS:C2931613|MESH:C567389|MESH:C537790|ORDO:1834	MESH:C567389
MONDO:0013100	Bamforth-Lazarus syndrome	Disease	MONDO	Bamforth-Lazarus syndrome is a very rare syndrome of congenital hypothyroidism characterized by thyroid dysgenesis (in most cases athyreosis), cleft palate and spiky hair, with or without choanal atresia, and bifid epiglottis. Facial dysmorphism and porencephaly have been reported in isolated cases. [Orphanet:1226]	hypothyroidism-cleft palate syndrome|hypothyroidism, ATHYROIDAL, with spiky hair and cleft palate|Athyroidal hypothyroidism-spiky hair-cleft palate syndrome|Bamforth-Lazarus syndrome|Bamforth syndrome			OMIM:241850|DOID:0050655|MESH:C537901|MESH:C567802|ORDO:1226	MESH:C567802
MONDO:0013011	African iron overload	Disease	MONDO	African iron overload is a rare disorder described in sub-Saharan African populations and is characterized by iron overload due to excess dietary iron intake and possibly genetic factors, leading to hepatic portal fibrosis and micronodular cirrhosis. [Orphanet:139507]	Bantu siderosis|iron overload in Africa|African iron overload			MESH:C567561|MESH:C537904|DOID:0111033|OMIM:601195|ORDO:139507	MESH:C567561
MONDO:0020436	Bardet-Biedl syndrome 10	Disease	MONDO	Any Bardet-Biedl syndrome in which the cause of the disease is a mutation in the BBS10 gene. [MONDO:patterns/disease_series_by_gene]	Bardet-Biedl syndrome caused by mutation in BBS10|Bardet-Biedl syndrome 10|Bardet-Biedl syndrome type 10|BBS10 Bardet-Biedl syndrome|BBS10			MESH:C548009|DOID:0110132|OMIM:615987|MESH:C565919|UMLS:C1859568|HP:0011567	MESH:C548009
