id	name	label	resource	description	synonyms	pmids	taxid	xrefs	raw_id
MONDO:0012196	Bardet-Biedl syndrome 14	Disease	MONDO	A Bardet-Biedl syndrome that has material basis in homozygous mutation in the CEP290 gene on chromosome 12q21. [DOID:0110136, PMID:18327255]	BBS14|Bardet-Biedl syndrome 14, modifier of|Bardet-Biedl syndrome type 14|Bardet-Biedl syndrome 14			UMLS:C2673874|MESH:C563790|OMIM:615991|MESH:C567141|DOID:0110136	MESH:C563790
MONDO:0014700	Bardet-Biedl syndrome 15	Disease	MONDO	Any Bardet-Biedl syndrome in which the cause of the disease is a mutation in the WDPCP gene. [MONDO:patterns/disease_series_by_gene]	WDPCP Bardet-Biedl syndrome|Bardet-Biedl syndrome caused by mutation in WDPCP|BBS15|Bardet-Biedl syndrome type 15|Bardet-Biedl syndrome 15			DOID:0110137|UMLS:C3150127|OMIM:615992|OMIM:616580	OMIM:616580
MONDO:0011383	Bardet-Biedl syndrome 9	Disease	MONDO	Any Bardet-Biedl syndrome in which the cause of the disease is a mutation in the BBS9 gene. [MONDO:patterns/disease_series_by_gene]	BBS9 Bardet-Biedl syndrome|Bardet-Biedl syndrome type 9|Bardet-Biedl syndrome 9|Bardet-Biedl syndrome caused by mutation in BBS9|BBS9			UMLS:C1859567|MESH:C565833|OMIM:615986|DOID:0110131|MESH:C565918	MESH:C565833
MONDO:0013944	Barrett esophagus	Disease	MONDO	Esophageal lesion lined with columnar metaplastic epithelium which is flat or villiform. Barrett epithelium is characterized by two different types of cells: goblet cells and columnar cells. The symptomatology of Barrett esophagus is that of gastro-esophageal reflux. It is the precursor of most esophageal adenocarcinomas. (WHO) [NCIT:C2891]	Barrett's ulcer of esophagus|Barrett esophagus/esophageal adenocarcinoma|cello|CLE|ulcerative esophagitis|Barrett's esophagus with esophagitis|Barrett's esophagus|columnar-lined esophagus|Barrett's oesophagus|BE|columnar epithelial-lined Lower esophagus|Barretts syndrome|Barrett esophagus			OMIM:614878|MESH:D001471|OMIM:614266|DOID:9206|ICD-9:530.85|ORDO:1232|UMLS:C0279628|ORDO:99976	OMIM:614878
MONDO:0011233	basal ganglia calcification, idiopathic, 5	Disease	MONDO		basal ganglia calcification, idiopathic, 5|basal ganglia calcification, idiopathic, type 5			UMLS:C3809645|OMIM:602482|DOID:0110122|OMIM:615483	OMIM:602482
MONDO:0015944	primary basilar invagination	Disease	MONDO	Primary basilar impression (PBI) is a very rare skeletal developmental defect characterized by congenital upward translocation of the upper cervical spine and clivus into the foramen magnum. PBI can be asymptomatic or associated with severe neurological dysfunction. [Orphanet:2285]	Bull-Nixon syndrome			MESH:C566226|ORDO:2285|UMLS:C1862299|OMIM:109500|MESH:C537790	MESH:C537790
MONDO:0009437	Becker nevus syndrome	Disease	MONDO	Becker nevus syndrome is characterized by the presence of a Becker nevus in association withunderdevelopment (hypoplasia)of the breast or other skin-related, muscular, or skeletal defects, all of which usually involve the same side of the bodyas the nevus (ipsilateral). Specific signs and symptoms in addition to the nevus may include ipsilateral breast hypoplasia;skeletal abnormalities such ashypoplasia of the shoulder girdle, scoliosis, fused ribs, and ipsilateral shortness of the arm; and several other features. Thecondition is thought to be sporadic (occurring in individuals with no history of the condition in the family). Treatment varies depending upon the specific symptoms present and the extent of the condition in the affected individual. [https://rarediseases.info.nih.gov/diseases/3856/becker-nevus-syndrome]	Becker nevus syndrome|pigmentary hairy epidermal nevus			OMIM:604919|MESH:C537901|MESH:C565735|UMLS:C1858042|ORDO:64755	MESH:C537901
MONDO:0011012	Beckwith-Wiedemann syndrome	Disease	MONDO	Beckwith-Wiedemann syndrome (BWS) is a genetic disorder characterized by overgrowth, tumor predisposition and congenital malformations. [Orphanet:116]	Wiedemann-Beckwith syndrome|Beckwith-Wiedemann syndrome|exomphalos-macroglossia-gigantism syndrome|BWS			DOID:5572|ICD-9:759.89|ORDO:116|MESH:C537904|UMLS:C0004903|OMIM:130650|MESH:D001506	MESH:C537904
MONDO:0014438	Becker muscular dystrophy	Disease	MONDO	Becker muscular dystrophy (BMD) is a neuromuscular disease characterized by progressive muscle wasting and weakness due to degeneration of skeletal, smooth and cardiac muscle. [Orphanet:98895]	Becker muscular dystrophy, X-linked recessive|Becker dystrophinopathy|benign pseudohypertrophic muscular dystrophy|BMD|benign congenital myopathy|Becker muscular dystrophy			DOID:9883|MESH:C570377|UMLS:C3490459|OMIM:300376|MESH:C565919|ORDO:98895|UMLS:C0699741	MESH:C565919
MONDO:0014442	autosomal recessive bestrophinopathy	Disease	MONDO	Autosomal recessive bestrophinopathy (ARB) is a retinal dystrophy, characterized by central visual loss in the first 2 decades of life, associated with an absent electrooculogram (EOG) light rise and a reduced electroretinogram (ERG). [Orphanet:139455]	retinopathy, Burgess-Black type|bestrophinopathy			UMLS:C2678493|DOID:0050662|ICD10CM:H35.5|MESH:C567141|ORDO:139455|UMLS:C3888198|MESH:C567518|OMIM:611809	MESH:C567141
MONDO:0014443	3-hydroxyisobutyryl-CoA hydrolase deficiency	Disease	MONDO	Neurodegeneration due to 3-hydroxyisobutyryl-CoA hydrolase deficiency is characterised by delayed motor development, hypotonia and progressive neurodegeneration. To date, it has been described in four boys. The syndrome is caused by mutations affecting the two alleles of the HIBCH gene, encoding 3-hydroxyisobutyryl-CoA hydrolase. The mode of transmission has not yet been established. [Orphanet:88639]	3-hydroxyisobutyryl-CoA hydrolase deficiency|methacrylic aciduria|3-hydroxyisobutryl-CoA hydrolase deficiency|HIBCH deficiency|neurodegeneration due to 3-hydroxyisobutyryl-CoA hydrolase deficiency			OMIM:250620|OMIM:615992|DOID:0110137|ORDO:88639|MESH:C562803	OMIM:615992
MONDO:0014437	beta-mannosidosis	Disease	MONDO	Beta-mannosidosis is a very rare lysosomal storage disease characterized by developmental delay of varying severity and hearing loss, but that can manifest a wide phenotypic heterogeneity. [Orphanet:118]	lysosomal beta-mannosidase deficiency|beta-mannosidase deficiency|Beta-mannosidase deficiency|mannosidosis, beta|beta-mannosidosis|Beta-D-mannosidosis			ORDO:118|MESH:D044905|ICD-9:271.8|OMIM:248510|DOID:3633|UMLS:C4048196|MESH:C565918	MESH:C565918
MONDO:0013662	bidirectional tachycardia	Disease	MONDO	A condition with damage to the lining of the lower ESOPHAGUS resulting from chronic acid reflux (ESOPHAGITIS, REFLUX). Through the process of metaplasia, the squamous cells are replaced by a columnar epithelium with cells resembling those of the INTESTINE or the salmon-pink mucosa of the STOMACH. Barrett's columnar epithelium is a marker for severe reflux and precursor to ADENOCARCINOMA of the esophagus.				MESH:D001471|MESH:C535438|DOID:9206|HP:0100580|UMLS:C2930902	MESH:D001471
MONDO:0014204	congenital bile acid synthesis defect 2	Disease	MONDO	Congenital bile acid synthesis defect type 2 (BAS defect type 2) is an anomaly of bile acid synthesis characterized by severe and rapidly progressive cholestatic liver disease, and malabsorption of fat and fat-soluble vitamins. [Orphanet:79303]	CBAS2|BASD2|congenital bile acid synthesis defect caused by mutation in AKR1D1|bile acid synthesis defect, congenital, type 2|congenital bile acid synthesis defect type 2|AKR1D1 congenital bile acid synthesis defect|cholestasis with delta(4)-3-oxosteroid 5-beta-reductase deficiency			OMIM:235555|DOID:0111069|ORDO:79303|UMLS:C1856127|MESH:C535443|OMIM:615483|DOID:0060230	OMIM:615483
MONDO:0007188	primary biliary cholangitis 2	Disease	MONDO					DOID:0070359|MESH:C566226|MESH:C567817|UMLS:C2751696|OMIM:613007	MESH:C566226
MONDO:0011500	Bjornstad syndrome	Disease	MONDO	Bjrnstad syndrome is characterized by congenital sensorineural hearing loss and pili torti. Less than fifty cases have been reported so far. The hearing loss usually becomes evident very early in life, often in the first year. Pili torti, a condition in which the hair shaft is flattened and twisted, makes the hair very brittle and patients develop hair loss in the first two years of life. Bjrnstad syndrome is transmitted as an autosomal recessive condition. It is caused by mutations in the BCS1L gene. Mutations in this gene also cause GRACILE syndrome. [https://rarediseases.info.nih.gov/diseases/22/bjornstad-syndrome]	deafness-pili torti-hypogonadism syndrome|Bjornstad syndrome			ORDO:123|MESH:C537633|DOID:0050677|MESH:C565735|UMLS:C0266006|OMIM:262000	MESH:C565735
MONDO:0007534	Blau syndrome	Disease	MONDO	Blau syndrome (BS) is a rare systemic inflammatory disease characterized by early onset granulomatous arthritis, uveitis and skin rash. BS now refers to both the familial and sporadic (formerly early-onset sarcoidosis) form of the same disease. The proposed term pediatric granulomatous arthritis is currently questioned since it fails to represent the systemic nature of the disease. [Orphanet:90340]	granulomatosis, familial, Blau type|sarcoidosis, early-onset|Blau syndrome|early-onset sarcoidosis|granulomatous inflammatory arthritis, dermatitis, and uveitis, familial|Jabs syndrome|arthrocutaneouveal granulomatosis|granulomatosis, familial juvenile systemic|EOS|pediatric granulomatous arthritis|BLAUS			DOID:5572|ICD-9:714.89|ICD-9:692.9|UMLS:C1861303|OMIM:609464|OMIM:186580|MESH:D001506|ORDO:90341|DOID:0050678|ORDO:90340|MESH:C538157|UMLS:C1836122	MESH:D001506
MONDO:0010311	blindness (disorder)	Disease	MONDO	The lack of vision. It is caused by neurological or physiological factors. [NCIT:C97109]	visual impairment|vision loss|vision impairment			ICD10CM:H54|MESH:D001766|ICD-9:369|MESH:C570377|DOID:1432	MESH:C570377
MONDO:0012733	blue nevi, familial multiple	Disease	MONDO		blue nevi, familial multiple			UMLS:C1863617|MESH:C566346|DOID:0050662|MESH:C567518|OMIM:603670	MESH:C567518
MONDO:0009603	blue rubber bleb nevus	Disease	MONDO	Blue rubber bleb nevus (BRBNS) is a rare vascular malformation disorder with cutaneous and visceral lesions frequently associated with serious, potentially fatal bleeding and anemia. [Orphanet:1059]	BRBN|blue rubber bleb nevus|bean syndrome			OMIM:112200|ORDO:1059|UMLS:C0346072|MESH:C562803|MESH:C536240	MESH:C562803
MONDO:0009562	Bothnia retinal dystrophy	Disease	MONDO	A rare form of retinal dystrophy, seen mostly in Northern Sweden, presenting in early childhood with night blindness and progressive maculopathy with a decrease in visual acuity, eventually leading to blindness by adulthood. Retinal degeneration, without obvious bone spicule formation, accompanied by affected visual fields and the typical presence of retinitis punctata albescens in the posterior pole are also noted. [Orphanet:85128]	Västerbotten dystrophy|Vasterbotten dystrophy|VC$sterbotten dystrophy|Bothnia retinal dystrophy			UMLS:C1843816|MESH:D044905|OMIM:607475|DOID:0050683|ICD10CM:H35.5|MESH:C564392|DOID:3633|ORDO:85128	MESH:D044905
MONDO:0022568	botulism	Disease	MONDO	A serious bacterial infection caused by botulinum toxin which is produced by Clostridium botulinum. Patients are infected usually by ingestion of contaminated food or wound contamination. It leads to muscle paralysis which may result in respiratory failure. [NCIT:C84599]	botulism poisoning|infection due to Clostridium botulinum|botulism			UMLS:C0006057|MESH:D001906|MESH:C535438|ORDO:1267|DOID:11976	MESH:C535438
MONDO:0009339	boutonneuse fever	Disease	MONDO	An infectious disease of the Mediterranean area, the Crimea, Africa, and India, caused by infection with rickettsia conorii subsp. coronorii. [PMID:18760001]	Mediterranean spotted fever|Kenya fever|boutonneuse fever|fievre boutonneuse|Kenyan tick typhus|Mediterranean tick fever|tick typhus due to rickettsia conorii|Conor and Bruch's disease|marseilles fever|South African tick-bite fever|African tick typhus|boutonneuse disease|Kenya tick typhus			MESH:D001907|ORDO:101334|UMLS:C0006060|DOID:0111069|DOID:14095|ICD-9:082.1|MESH:C535443|ORDO:83313	MESH:C535443
MONDO:0013079	brachydactyly-syndactyly syndrome	Disease	MONDO	Brachydactyly-syndactyly, Zhao type is a recently described syndrome associating a brachydactyly type A4 (short middle phalanges of the 2nd and 5th fingers and absence of middle phalanges of the 2nd to 5th toes) and a syndactyly of the 2nd and 3rd toes. Metacarpals and metatarsals anomalies are common. [Orphanet:93409]	brachydactyly-syndactyly syndrome			ORDO:93409|MESH:C567817|DOID:0050689|MESH:C565193|UMLS:C1853137|OMIM:610713	MESH:C567817
MONDO:0009872	brachydactyly type A5	Disease	MONDO	Brachydactyly type A5 (BDA5) is a very rare congenital malformation of the digits characterized by absence of the middle phalanges (usually of digits 2 to 5), nail dysplasia and duplicated terminal phalanx of the thumb. [Orphanet:93389]				MESH:C537091|MESH:C537633|OMIM:112900|DOID:0050677|UMLS:C1862138|ORDO:93389	MESH:C537633
MONDO:0008523	brachydactyly type E1	Disease	MONDO	Any brachydactyly type E in which the cause of the disease is a mutation in the HOXD13 gene. [MONDO:patterns/disease_series_by_gene]	BDE1|HOXD13 brachydactyly type E|brachydactyly type E caused by mutation in HOXD13			OMIM:113300|DOID:0110972|MESH:C538157|MESH:C566194	MESH:C538157
MONDO:0001941	brachymesomelia-renal syndrome	Disease	MONDO	The inability to see or the loss or absence of perception of visual stimuli. This condition may be the result of EYE DISEASES; OPTIC NERVE DISEASES; OPTIC CHIASM diseases; or BRAIN DISEASES affecting the VISUAL PATHWAYS or OCCIPITAL LOBE.	brachymesomelia-renal syndrome			MESH:D001766|OMIM:113470|UMLS:C1862084|MESH:C537096|HP:0000618	MESH:D001766
MONDO:0011358	hereditary breast carcinoma	Disease	MONDO	Breast carcinoma that has developed in relatives of patients with history of breast carcinoma. [NCIT:P378]	breast cancer, susceptibility to, autosomal dominant, somatic mutation|hereditary breast cancer|breast cancer susceptibility, autosomal dominant, somatic mutation|breast cancer, somatic|familial breast carcinoma|breast cancer, invasive ductal, autosomal dominant, somatic mutation|breast cancer, lobular, somatic|familial breast cancer|familial cancer of breast|breast cancer, male, susceptibility to, autosomal dominant, somatic mutation|familial cancer of the breast|hereditary breast carcinoma|breast cancer, early-onset, susceptibility to, autosomal dominant, somatic mutation|breast cancer, protection against, autosomal dominant, somatic mutation			ICD10CM:C50.2|MESH:C566346|ICD10CM:C50.3|OMIM:114480|UMLS:C0346153|ICD10CM:C50.6|ORDO:227535|MESH:C562840	MESH:C566346
MONDO:0007203	male breast carcinoma	Disease	MONDO	A malignant neoplasm involving the male breast. [https://orcid.org/0000-0002-6601-2165]	male breast carcinoma|male breast cancer|neoplasm of male breast|carcinoma of Male breast|Male breast carcinoma|carcinoma of the Male breast|malignant neoplasm of male breast|Male breast cancer|carcinoma of male breast			UMLS:C0242788|UMLS:C0242787|DOID:1614|MESH:D018567|ICD-9:175.9|UMLS:C0238033|MESH:C536240	MESH:C536240
MONDO:0011838	breast-ovarian cancer, familial, susceptibility to, 1	Disease	MONDO	Any hereditary breast ovarian cancer syndrome in which the cause of the disease is a mutation in the BRCA1 gene. [MONDO:patterns/disease_series_by_gene]	breast-ovarian cancer, familial, susceptibility to, 1|breast-ovarian cancer, familial, 1, multifactorial|BRCA1 hereditary breast ovarian cancer syndrome|breast-ovarian cancer, familial, susceptibility to, type 1|hereditary breast ovarian cancer syndrome caused by mutation in BRCA1			MESH:C564392|OMIM:604370	MESH:C564392
MONDO:0005498	breast-ovarian cancer, familial, susceptibility to, 4	Disease	MONDO	Any hereditary breast ovarian cancer syndrome in which the cause of the disease is a mutation in the RAD51D gene. [MONDO:patterns/disease_series_by_gene]	hereditary breast ovarian cancer syndrome caused by mutation in RAD51D|RAD51D hereditary breast ovarian cancer syndrome|breast-ovarian cancer, familial, susceptibility to, type 4|breast-ovarian cancer, familial, susceptibility to, 4			OMIM:614291|MESH:D001906|DOID:11976	MESH:D001906
MONDO:0024472	bronchiectasis	Disease	MONDO	Segmental, irreversible dilation of the bronchial tree resulting in the accumulation of secretions which leads to obstruction. The most common cause is bacterial infection. [NCIT:P378]	Polynesian bronchiectasis			ICD-9:494|MESH:D001907|MESH:D001987|ICD10CM:J47|DOID:14095|DOID:9563|UMLS:C0006267	MESH:D001907
MONDO:0012544	bronchiolitis	Disease	MONDO	Inflammation of the bronchioles characterized by swelling of the bronchioles and mucus accumulation. It is usually caused by the respiratory syncytial virus and affects children. Signs and symptoms include coughing, wheezing, and shortness of breath. [NCIT:P378]	bronchiolitis|wheezy bronchitis|bronchiolitis (disease)			UMLS:C0006271|HP:HP:0011950|DOID:2942|ICD-9:466.19|DOID:0050689|MESH:D001988|MESH:C565193	MESH:C565193
MONDO:0019678	Brown-Sequard syndrome	Disease	MONDO	Brown-Sequard syndrome is a rare neurological condition that results from an injury or damage to one side of the spinal cord. This condition results in weakness or paralysis on one side of the body (hemiparaplegia) and a loss of sensation on the opposite side (hemianesthesia). Brown-Sequard syndrome most commonly occurs in the the thoracic spine (upper and middle back). There are several causes of Brown-Sequard syndrome, including: a spinal cord tumor, trauma (such as a puncture wound to the neck or back), infectious or inflammatory diseases (tuberculosis or multiple sclerosis), and disk herniation. Treatment for this condition varies depending on the underlying cause. [https://rarediseases.info.nih.gov/diseases/5964/brown-sequard-syndrome]	Brown-Squard syndrome			MESH:C537091|MESH:D018437|ICD10CM:G83.81|DOID:606	MESH:C537091
MONDO:0007223	Brugada syndrome 8	Disease	MONDO	Any Brugada syndrome in which the cause of the disease is a mutation in the HCN4 gene. [MONDO:patterns/disease_series_by_gene]	Brugada syndrome caused by mutation in HCN4|HCN4 Brugada syndrome|Brugada syndrome type 8|Brugada syndrome 8|BRGDA8			DOID:0110225|MESH:C567732|UMLS:C2751083|OMIM:613123|OMIM:113300|DOID:0110972	OMIM:113300
MONDO:0007228	Brunoni syndrome	Disease	MONDO					UMLS:C2931486|MESH:C537408|MESH:C537096	MESH:C537096
MONDO:0016419	Bruton-type agammaglobulinemia	Disease	MONDO	X-linked agammaglobulinemia (XLA) is a clinically variable form of isolated agammaglobulinemia, an inherited immunodeficiency disorder, and is characterized in affected males by recurrent bacterial infections during infancy. [Orphanet:47]	Bruton's Sex-linked agammaglobulinemia|X-linked agammaglobulinemia|Bruton's type agammaglobulinemia|BTK deficiency|Bruton type agammaglobulinemia|agammaglobulinemia, X-linked 1, X-linked recessive|Bruton agammaglobulinemia tyrosine kinase deficiency|Bruton's X-linked agammaglobulinemia|BTK-deficiency|Bruton's agammaglobulinaemia|Bruton-type agammaglobulinemia			ORDO:47|MESH:C537409|DOID:14179|UMLS:C0221026|OMIM:300755|MESH:C562840	MESH:C562840
MONDO:0005628	progressive bulbar palsy	Disease	MONDO	Progressive bulbar palsy involves the brain stem. The brain stem is the part of the brain needed for swallowing, speaking, chewing, and other functions. Signs and symptoms of progressive bulbar palsy include difficulty swallowing, weak jaw and facial muscles, progressive loss of speech, and weakening of the tongue. Additional symptoms include less prominent weakness in the arms and legs, and outbursts of laughing or crying (called emotional lability). Progressive bulbar palsy is considered a variant form of amyotrophic lateral sclerosis (ALS). Many people with progressive bulbar palsy later develop ALS. While there is no cure for progressive bulbar palsy or for ALS, doctors can treat symptoms. [https://rarediseases.info.nih.gov/diseases/10928/progressive-bulbar-palsy]				MESH:D010244|ICD-9:335.22|UMLS:C0030442|ICD10CM:G12.22|DOID:1614|MESH:D018567|DOID:681	MESH:D018567
MONDO:0011450	progressive familial heart block, type 1A	Disease	MONDO	An autosomal dominant inherited cardiac bundle branch disorder which can progress to complete heart block. [NCIT:C126651]	PFHB1A|progressive familial heart block caused by mutation in SCN5A|Lenegre's disease|heart block, progressive, type IA|progressive familial heart block, type IA|SCN5A progressive familial heart block			OMIM:113900|OMIM:604370|DOID:0111074|MESH:D002037	OMIM:604370
MONDO:0013669	hereditary arterial and articular multiple calcification syndrome	Disease	MONDO	Hereditary arterial and articular multiple calcification syndrome is a very rare genetic vascular disease of autosomal recessive inheritance, described in less than 20 patients to date, characterized by adult-onset (as early as the second decade of life) isolated calcification of the arteries of the lower extremities (including the iliac, femoral, and tibial arteries) as well as the capsule joints of the fingers, wrists, ankles and feet, and that usually manifests with mild paresthesias of the lower extremities, intense joint pain and swelling, and early onset arthritis of affected joints. [Orphanet:289601]	CALJA|calcification of joints and arteries			OMIM:211800|DOID:0111582|ORDO:289601|UMLS:C1859372|OMIM:614291|MESH:C565891|UMLS:C4305347	OMIM:614291
MONDO:0004822	Caliciviridae infectious disease	Disease	MONDO	Virus diseases caused by caliciviridae. They include hepatitis E; vesicular exanthema of swine; acute respiratory infections in felines, rabbit hemorrhagic disease, and some cases of gastroenteritis in humans. [MESH:D017250]				HP:0002110|MESH:D001987|MESH:D017250|DOID:9563	MESH:D001987
MONDO:0002465	idiopathic camptocormia	Disease	MONDO	Idiopathic camptocormia is a postural disease characterized by an anterior flexion of the torso (during walking or standing) that resolves in the supine position and that is caused by weakness of the lumbar paraspinal muscles (spinal extensors), due to massive fatty infiltrations of posterior spinal muscles, without an identifiable etiology. [Orphanet:1320]	idiopathic camptocormism|idiopathic progressive lumbar kyphosis			DOID:2942|MESH:C537968|HP:0011950|MESH:D001988|ORDO:1320	MESH:D001988
MONDO:0003754	cutaneous candidiasis	Disease	MONDO	Candidiasis of the skin manifested as eczema-like lesions of the interdigital spaces, perleche, or chronic paronychia. (Dorland, 27th ed) [MESH:D002179]	zone of skin candidiasis			MESH:D002179|DOID:0080161|UMLS:C0006846|MESH:D018437|DOID:606	MESH:D018437
MONDO:0013148	candidiasis, familial, 8	Disease	MONDO	Any chronic mucocutaneous candidiasis in which the cause of the disease is a mutation in the TRAF3IP2 gene. [MONDO:patterns/disease_series_by_gene]	TRAF3IP2 chronic mucocutaneous candidiasis (disease)|chronic mucocutaneous candidiasis (disease) caused by mutation in TRAF3IP2|candidiasis, familial, 8|candidiasis, familial, type 8			MESH:C567732|OMIM:615527|UMLS:C3714992	MESH:C567732
MONDO:0022611	familial multiple nevi flammei	Disease	MONDO	A congenital vascular malformation in the skin (birthmark) characterized by the presence of dilated capillaries. The affected area of the skin is flat and reddish-purplish in color. [NCIT:C3840]	port wine stain of skin|port wine type hemangioma|familial multiple port-wine stains|port-wine stain of skin|capillary malformations, congenital, 1, somatic, mosaic|port wine birthmark|port wine stain of the skin|port wine Nevus|port wine stain|Nevus flammeus|Salmon patch Nevus			ORDO:624|UMLS:CN205384|UMLS:C0235752|DOID:0111529|MESH:C537408|OMIM:163000	MESH:C537408
MONDO:0010421	Caplan syndrome	Disease	MONDO	A combination of rheumatoid arthritis (RA) and pneumoconiosis that manifests as intrapulmonary nodules, which appear homogenous and well-defined on chest X-ray. [Wikipedia:Caplan%27s_syndrome]	Caplan syndrome|Caplan's disease|rheumatoid pneumoconiosis|Caplans syndrome			MESH:C537409|DOID:14179|UMLS:C0006915|DOID:10326|MESH:D002205	MESH:C537409
MONDO:0008890	cerebellar ataxia-areflexia-pes cavus-optic atrophy-sensorineural hearing loss syndrome	Disease	MONDO	Cerebellar ataxia - areflexia - pes cavus - optic atrophy - sensorineural hearing loss (CAPOS syndrome) is a rare autosomal dominant neurological disorder characterized by early onset cerebellar ataxia, associated with areflexia, progressive optic atrophy, sensorineural deafness, a pes cavus deformity, and abnormal eye movements. [Orphanet:1171]	CAPOS syndrome			ORDO:1171|MESH:D010244|HP:0001283|MESH:C535351|DOID:681|OMIM:601338	MESH:D010244
MONDO:0007240	basal cell carcinoma	Disease	MONDO	A carcinoma involving the basal cells. [NCIT:C156767]	epithelioma, basal cell|malignant basal cell neoplasm|basal cell cancer			MESH:D002280|HP:0011710|HP:0011713|HP:0011712|MESH:D002037	MESH:D002037
MONDO:0008895	mucoepidermoid carcinoma	Disease	MONDO	A carcinoma morphologically characterized the presence of cuboidal mucous cells, goblet-like mucous cells, squamoid cells, cystic changes, and a fibrotic stromal formation. It can occur in several anatomic sites, including parotid gland, oral cavity, paranasal sinus, skin, breast, lung, larynx, and lacrimal ducts. It is classified as low or high grade. [NCIT:C3772]	mucoepidermoid carcinoma (morphologic abnormality)|MEC|mucoepidermoid tumor|mucoepidermoid carcinoma			MESH:D018277|DOID:4531|UMLS:C0206694|MESH:C565891|MESH:D018298|DOID:163	MESH:C565891
MONDO:0005687	skin appendage carcinoma	Disease	MONDO	A carcinoma arising from the sebaceous glands, sweat glands, or the hair follicles. Representative examples include sebaceous carcinoma, apocrine carcinoma, eccrine carcinoma, and pilomatrical carcinoma. [NCIT:P378]	adnexal carcinoma|carcinoma of skin appendage|skin appendage carcinoma|cutaneous appendage carcinoma|carcinoma of adnexa|carcinoma, adnexal, malignant|carcinoma of cutaneous appendage			MESH:D018280|MESH:D017250|UMLS:C0206697	MESH:D017250
